{
  "request_id": "inf-INC-4821-triage-0001",
  "tenant_id": "tenant-acme",
  "model_class": "chat.general",
  "outcome": "completed",
  "output": { "root_cause_hypothesis": "credential stuffing followed by lateral movement", "confidence": "medium" },
  "data_marking": { "classification": "confidential", "tlp": "TLP:AMBER", "handling": ["no-export"] },
  "redaction": { "profile": "soc.pii_strip", "enforced": true, "categories_removed": ["pii"] },
  "usage": { "input_tokens": 6120, "output_tokens": 210, "total_tokens": 6330 },
  "latency": { "queue_ms": 40, "inference_ms": 880, "total_ms": 930 },
  "created_at": "2026-07-24T18:22:05Z",
  "telemetry": { "audit_ref": "audit-inf-0001", "eval_ref": "eval-inf-0001" },
  "correlation": { "correlation_id": "corr-INC-4821", "investigation_id": "inv-INC-4821" }
}
